[2025-12-10 15:13:21] ================================================================================
[2025-12-10 15:13:21] LMM Model Selection: Kitchen Sink Suite
[2025-12-10 15:13:21] ================================================================================
[2025-12-10 15:13:21] [VALIDATION] Checking inputs...
[2025-12-10 15:13:21]   TSVR variable: TSVR_hours
[2025-12-10 15:13:21]   TSVR range: [1.00, 246.24] hours
[2025-12-10 15:13:21]   TSVR unique values: 295
[2025-12-10 15:13:21]   Outcome: theta
[2025-12-10 15:13:21]   Groups: UID (N=100)
[2025-12-10 15:13:21]   N observations: 800
[2025-12-10 15:13:21]   Factor 1: location (categorical, ref=Source)
[2025-12-10 15:13:21]   Interaction: 1-way (time × factor1)
[2025-12-10 15:13:21]   Random effects: ~TSVR_hours
[2025-12-10 15:13:21]   REML: False
[2025-12-10 15:13:21] [TRANSFORM] Creating time transformations...
[2025-12-10 15:13:21]   Polynomial family...
[2025-12-10 15:13:21]   Logarithmic family...
[2025-12-10 15:13:21]   Power law family...
[2025-12-10 15:13:21]   Root family...
[2025-12-10 15:13:21]   Reciprocal family...
[2025-12-10 15:13:21]   Exponential family...
[2025-12-10 15:13:21]   Trigonometric family...
[2025-12-10 15:13:21]   Hyperbolic family...
[2025-12-10 15:13:21]   Total transformations created: 32
[2025-12-10 15:13:21] [CONFIG] Defining model suite...
[2025-12-10 15:13:21]   Total models defined: 66
[2025-12-10 15:13:21] [FORMULA] Building model formulas...
[2025-12-10 15:13:21]   Example formula (Linear): theta ~ TSVR * C(location, Treatment('Source'))
[2025-12-10 15:13:21]   Example formula (Log): theta ~ log_TSVR * C(location, Treatment('Source'))
[2025-12-10 15:13:21] [ANALYSIS] Fitting all models...
[2025-12-10 15:13:21]   This may take 5-10 minutes for 66 models...
[2025-12-10 15:13:21]   [1/66] Fitting Linear...
[2025-12-10 15:13:21]     ✓ AIC=1583.14, converged=False
[2025-12-10 15:13:21]   [2/66] Fitting Quadratic...
[2025-12-10 15:13:22]     ✓ AIC=1545.25, converged=False
[2025-12-10 15:13:22]   [3/66] Fitting Cubic...
[2025-12-10 15:13:23]     ✓ AIC=1541.53, converged=False
[2025-12-10 15:13:23]   [4/66] Fitting Quartic...
[2025-12-10 15:13:23]     ✓ AIC=1539.78, converged=True
[2025-12-10 15:13:23]   [5/66] Fitting Quadratic_pure...
[2025-12-10 15:13:24]     ✓ AIC=1543.26, converged=False
[2025-12-10 15:13:24]   [6/66] Fitting Cubic_pure...
[2025-12-10 15:13:24]     ✓ AIC=1550.31, converged=False
[2025-12-10 15:13:24]   [7/66] Fitting Log...
[2025-12-10 15:13:25]     ✓ AIC=1535.71, converged=False
[2025-12-10 15:13:25]   [8/66] Fitting Log2...
[2025-12-10 15:13:26]     ✓ AIC=1535.71, converged=False
[2025-12-10 15:13:26]   [9/66] Fitting Log10...
[2025-12-10 15:13:26]     ✓ AIC=1535.71, converged=False
[2025-12-10 15:13:26]   [10/66] Fitting LogLog...
[2025-12-10 15:13:27]     ✓ AIC=1534.80, converged=False
[2025-12-10 15:13:27]   [11/66] Fitting Lin+Log...
[2025-12-10 15:13:27]     ✓ AIC=1537.71, converged=False
[2025-12-10 15:13:27]   [12/66] Fitting Quad+Log...
[2025-12-10 15:13:28]     ✓ AIC=1538.80, converged=False
[2025-12-10 15:13:28]   [13/66] Fitting Log+LogLog...
[2025-12-10 15:13:29]     ✓ AIC=1536.63, converged=False
[2025-12-10 15:13:29]   [14/66] Fitting Lin+Quad+Log...
[2025-12-10 15:13:29]     ✓ AIC=1538.80, converged=False
[2025-12-10 15:13:29]   [15/66] Fitting PowerLaw_01...
[2025-12-10 15:13:30]     ✓ AIC=1535.54, converged=False
[2025-12-10 15:13:30]   [16/66] Fitting PowerLaw_02...
[2025-12-10 15:13:31]     ✓ AIC=1535.38, converged=False
[2025-12-10 15:13:31]   [17/66] Fitting PowerLaw_03...
[2025-12-10 15:13:31]     ✓ AIC=1535.25, converged=True
[2025-12-10 15:13:31]   [18/66] Fitting PowerLaw_04...
[2025-12-10 15:13:32]     ✓ AIC=1535.14, converged=False
[2025-12-10 15:13:32]   [19/66] Fitting PowerLaw_05...
[2025-12-10 15:13:32]     ✓ AIC=1535.05, converged=False
[2025-12-10 15:13:32]   [20/66] Fitting PowerLaw_06...
[2025-12-10 15:13:33]     ✓ AIC=1534.98, converged=False
[2025-12-10 15:13:33]   [21/66] Fitting PowerLaw_07...
[2025-12-10 15:13:34]     ✓ AIC=1534.93, converged=False
[2025-12-10 15:13:34]   [22/66] Fitting PowerLaw_08...
[2025-12-10 15:13:34]     ✓ AIC=1534.90, converged=False
[2025-12-10 15:13:34]   [23/66] Fitting PowerLaw_09...
[2025-12-10 15:13:35]     ✓ AIC=1534.88, converged=False
[2025-12-10 15:13:35]   [24/66] Fitting PowerLaw_10...
[2025-12-10 15:13:36]     ✓ AIC=1534.88, converged=False
[2025-12-10 15:13:36]   [25/66] Fitting PowerLaw_Log...
[2025-12-10 15:13:36]     ✓ AIC=1536.43, converged=False
[2025-12-10 15:13:36]   [26/66] Fitting PowerLaw_Lin...
[2025-12-10 15:13:37]     ✓ AIC=1536.16, converged=False
[2025-12-10 15:13:37]   [27/66] Fitting SquareRoot...
[2025-12-10 15:13:38]     ✓ AIC=1534.23, converged=False
[2025-12-10 15:13:38]   [28/66] Fitting CubeRoot...
[2025-12-10 15:13:38]     ✓ AIC=1534.33, converged=False
[2025-12-10 15:13:38]   [29/66] Fitting FourthRoot...
[2025-12-10 15:13:39]     ✓ AIC=1534.48, converged=False
[2025-12-10 15:13:39]   [30/66] Fitting Root_033...
[2025-12-10 15:13:40]     ✓ AIC=1534.33, converged=False
[2025-12-10 15:13:40]   [31/66] Fitting Root_067...
[2025-12-10 15:13:40]     ✓ AIC=1534.45, converged=False
[2025-12-10 15:13:40]   [32/66] Fitting SquareRoot+Log...
[2025-12-10 15:13:41]     ✓ AIC=1536.11, converged=False
[2025-12-10 15:13:41]   [33/66] Fitting CubeRoot+Log...
[2025-12-10 15:13:41]     ✓ AIC=1536.15, converged=False
[2025-12-10 15:13:41]   [34/66] Fitting SquareRoot+Lin...
[2025-12-10 15:13:42]     ✓ AIC=1535.67, converged=False
[2025-12-10 15:13:42]   [35/66] Fitting Root_Multi...
[2025-12-10 15:13:42]     ✓ AIC=1536.32, converged=True
[2025-12-10 15:13:42]   [36/66] Fitting Reciprocal...
[2025-12-10 15:13:43]     ✓ AIC=1534.88, converged=False
[2025-12-10 15:13:43]   [37/66] Fitting Recip+Log...
[2025-12-10 15:13:44]     ✓ AIC=1536.37, converged=False
[2025-12-10 15:13:44]   [38/66] Fitting Recip+Lin...
[2025-12-10 15:13:44]     ✓ AIC=1535.79, converged=False
[2025-12-10 15:13:44]   [39/66] Fitting Recip+Quad...
[2025-12-10 15:13:45]     ✓ AIC=1537.26, converged=True
[2025-12-10 15:13:45]   [40/66] Fitting Recip_sq...
[2025-12-10 15:13:45]     ✓ AIC=1535.43, converged=False
[2025-12-10 15:13:45]   [41/66] Fitting Recip+PowerLaw...
[2025-12-10 15:13:46]     ✓ AIC=1536.64, converged=False
[2025-12-10 15:13:46]   [42/66] Fitting Exponential_proxy...
[2025-12-10 15:13:46]     ✓ AIC=1583.14, converged=False
[2025-12-10 15:13:46]   [43/66] Fitting Exp+Log...
[2025-12-10 15:13:46]     ✓ AIC=1537.71, converged=False
[2025-12-10 15:13:46]   [44/66] Fitting Exp+Lin...
[2025-12-10 15:13:46]     ✗ FAILED: Singular matrix
[2025-12-10 15:13:46]   [45/66] Fitting Exp_fast...
[2025-12-10 15:13:47]     ✓ AIC=1543.26, converged=False
[2025-12-10 15:13:47]   [46/66] Fitting Exp_slow...
[2025-12-10 15:13:48]     ✓ AIC=1534.23, converged=False
[2025-12-10 15:13:48]   [47/66] Fitting Exp+PowerLaw...
[2025-12-10 15:13:48]     ✓ AIC=1537.05, converged=False
[2025-12-10 15:13:48]   [48/66] Fitting Exp+Recip...
[2025-12-10 15:13:49]     ✓ AIC=1536.88, converged=False
[2025-12-10 15:13:49]   [49/66] Fitting Sin...
[2025-12-10 15:13:50]     ✓ AIC=1543.15, converged=False
[2025-12-10 15:13:50]   [50/66] Fitting Cos...
[2025-12-10 15:13:50]     ✓ AIC=1574.90, converged=False
[2025-12-10 15:13:50]   [51/66] Fitting Sin+Cos...
[2025-12-10 15:13:51]     ✓ AIC=1542.94, converged=False
[2025-12-10 15:13:51]   [52/66] Fitting Sin+Log...
[2025-12-10 15:13:52]     ✓ AIC=1536.70, converged=False
[2025-12-10 15:13:52]   [53/66] Fitting Tanh...
[2025-12-10 15:13:52]     ✓ AIC=1548.95, converged=False
[2025-12-10 15:13:52]   [54/66] Fitting Tanh+Log...
[2025-12-10 15:13:53]     ✓ AIC=1536.88, converged=False
[2025-12-10 15:13:53]   [55/66] Fitting Arctanh...
[2025-12-10 15:13:54]     ✓ AIC=1571.15, converged=False
[2025-12-10 15:13:54]   [56/66] Fitting Sinh...
[2025-12-10 15:13:54]     ✓ AIC=1551.50, converged=False
[2025-12-10 15:13:54]   [57/66] Fitting Log+PowerLaw05...
[2025-12-10 15:13:55]     ✓ AIC=1536.70, converged=False
[2025-12-10 15:13:55]   [58/66] Fitting Log+SquareRoot...
[2025-12-10 15:13:56]     ✓ AIC=1536.07, converged=False
[2025-12-10 15:13:56]   [59/66] Fitting Log+Recip...
[2025-12-10 15:13:56]     ✓ AIC=1536.86, converged=False
[2025-12-10 15:13:56]   [60/66] Fitting SquareRoot+PowerLaw...
[2025-12-10 15:13:57]     ✓ AIC=1536.21, converged=False
[2025-12-10 15:13:57]   [61/66] Fitting SquareRoot+Recip...
[2025-12-10 15:13:58]     ✓ AIC=1536.73, converged=False
[2025-12-10 15:13:58]   [62/66] Fitting Recip+PowerLaw05...
[2025-12-10 15:13:58]     ✓ AIC=1536.64, converged=False
[2025-12-10 15:13:58]   [63/66] Fitting Lin+Log+PowerLaw...
[2025-12-10 15:13:59]     ✓ AIC=1538.71, converged=False
[2025-12-10 15:13:59]   [64/66] Fitting Quad+Log+SquareRoot...
[2025-12-10 15:14:00]     ✓ AIC=1539.64, converged=False
[2025-12-10 15:14:00]   [65/66] Fitting PowerLaw+Recip+Log...
[2025-12-10 15:14:00]     ✓ AIC=1537.77, converged=False
[2025-12-10 15:14:00]   [66/66] Fitting Ultimate...
[2025-12-10 15:14:01]     ✓ AIC=1542.47, converged=False
[2025-12-10 15:14:01]   Successful fits: 65/66
[2025-12-10 15:14:01]   Failed fits: 1
[2025-12-10 15:14:01] [COMPUTE] Computing AIC comparison metrics...
[2025-12-10 15:14:01]   Minimum AIC: 1534.23
[2025-12-10 15:14:01]   delta_AIC range: [0.00, 48.90]
[2025-12-10 15:14:01]   Akaike weight sum: 1.000000 (should be 1.0)
[2025-12-10 15:14:01] [RESULTS] Identifying best model...
[2025-12-10 15:14:01]   Best model: SquareRoot
[2025-12-10 15:14:01]   AIC: 1534.23
[2025-12-10 15:14:01]   Akaike weight: 0.0422 (4.2%)
[2025-12-10 15:14:01]   Uncertainty: High (<30% probability - weak support, consider model averaging)
[2025-12-10 15:14:01]   Log model (benchmark): Rank #22, AIC=1535.71, Δ=1.48, weight=0.0201
[2025-12-10 15:14:01] [VALIDATION] Validating AIC comparison metrics...
[2025-12-10 15:14:01]   ✓ Akaike weights sum to 1.0 (1.000000)
[2025-12-10 15:14:01]   ✓ All Akaike weights in (0, 1)
[2025-12-10 15:14:01]   ✓ Best model has delta_AIC = 0
[2025-12-10 15:14:01]   ✓ cumulative_weight monotonic increasing
[2025-12-10 15:14:01]   ✓ cumulative_weight ends at 1.0 (1.000000)
[2025-12-10 15:14:01] [OUTPUT] Preparing output dictionary...
[2025-12-10 15:14:01]   Competitive models (ΔAIC < 2): 29
[2025-12-10 15:14:01] [SAVE] Saving outputs to /home/etai/projects/REMEMVR/results/ch6/6.8.1/data...
[2025-12-10 15:14:01]   ✓ model_comparison.csv
[2025-12-10 15:14:01]   ✓ best_model_summary.txt[SUCCESS] Best model: SquareRoot (AIC=1534.23)
================================================================================
