[2025-12-10 15:22:01] ================================================================================
[2025-12-10 15:22:01] LMM Model Selection: Kitchen Sink Suite
[2025-12-10 15:22:01] ================================================================================
[2025-12-10 15:22:01] [VALIDATION] Checking inputs...
[2025-12-10 15:22:01]   TSVR variable: TSVR_hours
[2025-12-10 15:22:01]   TSVR range: [1.00, 246.24] hours
[2025-12-10 15:22:01]   TSVR unique values: 295
[2025-12-10 15:22:01]   Outcome: theta_All
[2025-12-10 15:22:01]   Groups: UID (N=100)
[2025-12-10 15:22:01]   N observations: 400
[2025-12-10 15:22:01]   Interaction: None (simple trajectory)
[2025-12-10 15:22:01]   Random effects: ~TSVR_hours
[2025-12-10 15:22:01]   REML: False
[2025-12-10 15:22:01] [TRANSFORM] Creating time transformations...
[2025-12-10 15:22:01]   Polynomial family...
[2025-12-10 15:22:01]   Logarithmic family...
[2025-12-10 15:22:01]   Power law family...
[2025-12-10 15:22:01]   Root family...
[2025-12-10 15:22:01]   Reciprocal family...
[2025-12-10 15:22:01]   Exponential family...
[2025-12-10 15:22:01]   Trigonometric family...
[2025-12-10 15:22:01]   Hyperbolic family...
[2025-12-10 15:22:01]   Total transformations created: 32
[2025-12-10 15:22:01] [CONFIG] Defining model suite...
[2025-12-10 15:22:01]   Total models defined: 66
[2025-12-10 15:22:01] [FORMULA] Building model formulas...
[2025-12-10 15:22:01]   Example formula (Linear): theta_All ~ TSVR
[2025-12-10 15:22:01]   Example formula (Log): theta_All ~ log_TSVR
[2025-12-10 15:22:01] [ANALYSIS] Fitting all models...
[2025-12-10 15:22:01]   This may take 5-10 minutes for 66 models...
[2025-12-10 15:22:01]   [1/66] Fitting Linear...
[2025-12-10 15:22:02]     ✓ AIC=1119.54, converged=False
[2025-12-10 15:22:02]   [2/66] Fitting Quadratic...
[2025-12-10 15:22:03]     ✓ AIC=1089.38, converged=False
[2025-12-10 15:22:03]   [3/66] Fitting Cubic...
[2025-12-10 15:22:03]     ✓ AIC=1073.48, converged=False
[2025-12-10 15:22:03]   [4/66] Fitting Quartic...
[2025-12-10 15:22:04]     ✓ AIC=1074.59, converged=False
[2025-12-10 15:22:04]   [5/66] Fitting Quadratic_pure...
[2025-12-10 15:22:05]     ✓ AIC=1086.63, converged=False
[2025-12-10 15:22:05]   [6/66] Fitting Cubic_pure...
[2025-12-10 15:22:05]     ✓ AIC=1096.63, converged=False
[2025-12-10 15:22:05]   [7/66] Fitting Log...
[2025-12-10 15:22:06]     ✓ AIC=1075.24, converged=False
[2025-12-10 15:22:06]   [8/66] Fitting Log2...
[2025-12-10 15:22:07]     ✓ AIC=1075.24, converged=False
[2025-12-10 15:22:07]   [9/66] Fitting Log10...
[2025-12-10 15:22:07]     ✓ AIC=1075.24, converged=False
[2025-12-10 15:22:07]   [10/66] Fitting LogLog...
[2025-12-10 15:22:08]     ✓ AIC=1073.54, converged=False
[2025-12-10 15:22:08]   [11/66] Fitting Lin+Log...
[2025-12-10 15:22:08]     ✓ AIC=1077.28, converged=False
[2025-12-10 15:22:08]   [12/66] Fitting Quad+Log...
[2025-12-10 15:22:09]     ✓ AIC=1075.04, converged=False
[2025-12-10 15:22:09]   [13/66] Fitting Log+LogLog...
[2025-12-10 15:22:10]     ✓ AIC=1074.85, converged=False
[2025-12-10 15:22:10]   [14/66] Fitting Lin+Quad+Log...
[2025-12-10 15:22:10]     ✓ AIC=1075.04, converged=False
[2025-12-10 15:22:10]   [15/66] Fitting PowerLaw_01...
[2025-12-10 15:22:11]     ✓ AIC=1074.90, converged=False
[2025-12-10 15:22:11]   [16/66] Fitting PowerLaw_02...
[2025-12-10 15:22:12]     ✓ AIC=1074.60, converged=False
[2025-12-10 15:22:12]   [17/66] Fitting PowerLaw_03...
[2025-12-10 15:22:12]     ✓ AIC=1074.32, converged=False
[2025-12-10 15:22:12]   [18/66] Fitting PowerLaw_04...
[2025-12-10 15:22:13]     ✓ AIC=1074.06, converged=False
[2025-12-10 15:22:13]   [19/66] Fitting PowerLaw_05...
[2025-12-10 15:22:14]     ✓ AIC=1073.84, converged=False
[2025-12-10 15:22:14]   [20/66] Fitting PowerLaw_06...
[2025-12-10 15:22:14]     ✓ AIC=1073.65, converged=False
[2025-12-10 15:22:14]   [21/66] Fitting PowerLaw_07...
[2025-12-10 15:22:15]     ✓ AIC=1073.48, converged=True
[2025-12-10 15:22:15]   [22/66] Fitting PowerLaw_08...
[2025-12-10 15:22:15]     ✓ AIC=1073.34, converged=False
[2025-12-10 15:22:15]   [23/66] Fitting PowerLaw_09...
[2025-12-10 15:22:16]     ✓ AIC=1073.22, converged=False
[2025-12-10 15:22:16]   [24/66] Fitting PowerLaw_10...
[2025-12-10 15:22:17]     ✓ AIC=1073.13, converged=False
[2025-12-10 15:22:17]   [25/66] Fitting PowerLaw_Log...
[2025-12-10 15:22:17]     ✓ AIC=1074.58, converged=False
[2025-12-10 15:22:17]   [26/66] Fitting PowerLaw_Lin...
[2025-12-10 15:22:18]     ✓ AIC=1075.84, converged=False
[2025-12-10 15:22:18]   [27/66] Fitting SquareRoot...
[2025-12-10 15:22:19]     ✓ AIC=1073.64, converged=False
[2025-12-10 15:22:19]   [28/66] Fitting CubeRoot...
[2025-12-10 15:22:19]     ✓ AIC=1073.32, converged=False
[2025-12-10 15:22:19]   [29/66] Fitting FourthRoot...
[2025-12-10 15:22:19]     ✓ AIC=1073.26, converged=False
[2025-12-10 15:22:19]   [30/66] Fitting Root_033...
[2025-12-10 15:22:19]     ✓ AIC=1073.32, converged=False
[2025-12-10 15:22:19]   [31/66] Fitting Root_067...
[2025-12-10 15:22:20]     ✓ AIC=1074.04, converged=False
[2025-12-10 15:22:20]   [32/66] Fitting SquareRoot+Log...
[2025-12-10 15:22:20]     ✓ AIC=1075.33, converged=False
[2025-12-10 15:22:20]   [33/66] Fitting CubeRoot+Log...
[2025-12-10 15:22:21]     ✓ AIC=1075.28, converged=False
[2025-12-10 15:22:21]   [34/66] Fitting SquareRoot+Lin...
[2025-12-10 15:22:22]     ✓ AIC=1075.70, converged=False
[2025-12-10 15:22:22]   [35/66] Fitting Root_Multi...
[2025-12-10 15:22:22]     ✓ AIC=1075.22, converged=False
[2025-12-10 15:22:22]   [36/66] Fitting Reciprocal...
[2025-12-10 15:22:23]     ✓ AIC=1073.13, converged=False
[2025-12-10 15:22:23]   [37/66] Fitting Recip+Log...
[2025-12-10 15:22:24]     ✓ AIC=1074.80, converged=False
[2025-12-10 15:22:24]   [38/66] Fitting Recip+Lin...
[2025-12-10 15:22:24]     ✓ AIC=1075.14, converged=False
[2025-12-10 15:22:24]   [39/66] Fitting Recip+Quad...
[2025-12-10 15:22:25]     ✓ AIC=1076.29, converged=False
[2025-12-10 15:22:25]   [40/66] Fitting Recip_sq...
[2025-12-10 15:22:25]     ✓ AIC=1073.13, converged=True
[2025-12-10 15:22:25]   [41/66] Fitting Recip+PowerLaw...
[2025-12-10 15:22:26]     ✓ AIC=1074.88, converged=False
[2025-12-10 15:22:26]   [42/66] Fitting Exponential_proxy...
[2025-12-10 15:22:26]     ✓ AIC=1119.54, converged=False
[2025-12-10 15:22:26]   [43/66] Fitting Exp+Log...
[2025-12-10 15:22:27]     ✓ AIC=1077.28, converged=False
[2025-12-10 15:22:27]   [44/66] Fitting Exp+Lin...
[2025-12-10 15:22:27]     ✗ FAILED: Singular matrix
[2025-12-10 15:22:27]   [45/66] Fitting Exp_fast...
[2025-12-10 15:22:28]     ✓ AIC=1086.63, converged=False
[2025-12-10 15:22:28]   [46/66] Fitting Exp_slow...
[2025-12-10 15:22:28]     ✓ AIC=1073.64, converged=False
[2025-12-10 15:22:28]   [47/66] Fitting Exp+PowerLaw...
[2025-12-10 15:22:29]     ✓ AIC=1075.84, converged=False
[2025-12-10 15:22:29]   [48/66] Fitting Exp+Recip...
[2025-12-10 15:22:30]     ✓ AIC=1075.14, converged=False
[2025-12-10 15:22:30]   [49/66] Fitting Sin...
[2025-12-10 15:22:30]     ✓ AIC=1078.09, converged=False
[2025-12-10 15:22:30]   [50/66] Fitting Cos...
[2025-12-10 15:22:31]     ✓ AIC=1115.72, converged=False
[2025-12-10 15:22:31]   [51/66] Fitting Sin+Cos...
[2025-12-10 15:22:32]     ✓ AIC=1068.98, converged=False
[2025-12-10 15:22:32]   [52/66] Fitting Sin+Log...
[2025-12-10 15:22:32]     ✓ AIC=1077.21, converged=False
[2025-12-10 15:22:32]   [53/66] Fitting Tanh...
[2025-12-10 15:22:33]     ✓ AIC=1091.74, converged=False
[2025-12-10 15:22:33]   [54/66] Fitting Tanh+Log...
[2025-12-10 15:22:34]     ✓ AIC=1072.04, converged=False
[2025-12-10 15:22:34]   [55/66] Fitting Arctanh...
[2025-12-10 15:22:34]     ✓ AIC=1114.55, converged=False
[2025-12-10 15:22:34]   [56/66] Fitting Sinh...
[2025-12-10 15:22:35]     ✓ AIC=1094.60, converged=False
[2025-12-10 15:22:35]   [57/66] Fitting Log+PowerLaw05...
[2025-12-10 15:22:36]     ✓ AIC=1074.58, converged=False
[2025-12-10 15:22:36]   [58/66] Fitting Log+SquareRoot...
[2025-12-10 15:22:36]     ✓ AIC=1075.33, converged=False
[2025-12-10 15:22:36]   [59/66] Fitting Log+Recip...
[2025-12-10 15:22:37]     ✓ AIC=1074.80, converged=False
[2025-12-10 15:22:37]   [60/66] Fitting SquareRoot+PowerLaw...
[2025-12-10 15:22:37]     ✓ AIC=1075.67, converged=False
[2025-12-10 15:22:37]   [61/66] Fitting SquareRoot+Recip...
[2025-12-10 15:22:38]     ✓ AIC=1073.63, converged=False
[2025-12-10 15:22:38]   [62/66] Fitting Recip+PowerLaw05...
[2025-12-10 15:22:39]     ✓ AIC=1074.88, converged=False
[2025-12-10 15:22:39]   [63/66] Fitting Lin+Log+PowerLaw...
[2025-12-10 15:22:39]     ✓ AIC=1076.69, converged=False
[2025-12-10 15:22:39]   [64/66] Fitting Quad+Log+SquareRoot...
[2025-12-10 15:22:40]     ✓ AIC=1075.42, converged=False
[2025-12-10 15:22:40]   [65/66] Fitting PowerLaw+Recip+Log...
[2025-12-10 15:22:40]     ✓ AIC=1074.28, converged=True
[2025-12-10 15:22:40]   [66/66] Fitting Ultimate...
[2025-12-10 15:22:41]     ✓ AIC=1078.13, converged=False
[2025-12-10 15:22:41]   Successful fits: 65/66
[2025-12-10 15:22:41]   Failed fits: 1
[2025-12-10 15:22:41] [COMPUTE] Computing AIC comparison metrics...
[2025-12-10 15:22:41]   Minimum AIC: 1068.98
[2025-12-10 15:22:41]   delta_AIC range: [0.00, 50.56]
[2025-12-10 15:22:41]   Akaike weight sum: 1.000000 (should be 1.0)
[2025-12-10 15:22:41] [RESULTS] Identifying best model...
[2025-12-10 15:22:41]   Best model: Sin+Cos
[2025-12-10 15:22:41]   AIC: 1068.98
[2025-12-10 15:22:41]   Akaike weight: 0.2171 (21.7%)
[2025-12-10 15:22:41]   Uncertainty: High (<30% probability - weak support, consider model averaging)
[2025-12-10 15:22:41]   Log model (benchmark): Rank #38, AIC=1075.24, Δ=6.25, weight=0.0095
[2025-12-10 15:22:41] [VALIDATION] Validating AIC comparison metrics...
[2025-12-10 15:22:41]   ✓ Akaike weights sum to 1.0 (1.000000)
[2025-12-10 15:22:41]   ✓ All Akaike weights in (0, 1)
[2025-12-10 15:22:41]   ✓ Best model has delta_AIC = 0
[2025-12-10 15:22:41]   ✓ cumulative_weight monotonic increasing
[2025-12-10 15:22:41]   ✓ cumulative_weight ends at 1.0 (1.000000)
[2025-12-10 15:22:41] [OUTPUT] Preparing output dictionary...
[2025-12-10 15:22:41]   Competitive models (ΔAIC < 2): 1
[2025-12-10 15:22:41] [SAVE] Saving outputs to /home/etai/projects/REMEMVR/results/ch6/6.1.1/data...
[2025-12-10 15:22:41]   ✓ model_comparison.csv
[2025-12-10 15:22:41]   ✓ best_model_summary.txt[SUCCESS] Best model: Sin+Cos (AIC=1068.98, w=0.2171)
  Converged: 65/66
================================================================================
