[2025-12-10 15:12:18] ================================================================================
[2025-12-10 15:12:18] LMM Model Selection: Kitchen Sink Suite
[2025-12-10 15:12:18] ================================================================================
[2025-12-10 15:12:18] [VALIDATION] Checking inputs...
[2025-12-10 15:12:18]   TSVR variable: TSVR_hours
[2025-12-10 15:12:18]   TSVR range: [1.00, 246.24] hours
[2025-12-10 15:12:18]   TSVR unique values: 295
[2025-12-10 15:12:18]   Outcome: theta
[2025-12-10 15:12:18]   Groups: UID (N=100)
[2025-12-10 15:12:18]   N observations: 1200
[2025-12-10 15:12:18]   Factor 1: domain (categorical, ref=What)
[2025-12-10 15:12:18]   Interaction: 1-way (time × factor1)
[2025-12-10 15:12:18]   Random effects: ~TSVR_hours
[2025-12-10 15:12:18]   REML: False
[2025-12-10 15:12:18] [TRANSFORM] Creating time transformations...
[2025-12-10 15:12:18]   Polynomial family...
[2025-12-10 15:12:18]   Logarithmic family...
[2025-12-10 15:12:18]   Power law family...
[2025-12-10 15:12:18]   Root family...
[2025-12-10 15:12:18]   Reciprocal family...
[2025-12-10 15:12:18]   Exponential family...
[2025-12-10 15:12:18]   Trigonometric family...
[2025-12-10 15:12:18]   Hyperbolic family...
[2025-12-10 15:12:18]   Total transformations created: 32
[2025-12-10 15:12:18] [CONFIG] Defining model suite...
[2025-12-10 15:12:18]   Total models defined: 66
[2025-12-10 15:12:18] [FORMULA] Building model formulas...
[2025-12-10 15:12:18]   Example formula (Linear): theta ~ TSVR * C(domain, Treatment('What'))
[2025-12-10 15:12:18]   Example formula (Log): theta ~ log_TSVR * C(domain, Treatment('What'))
[2025-12-10 15:12:18] [ANALYSIS] Fitting all models...
[2025-12-10 15:12:18]   This may take 5-10 minutes for 66 models...
[2025-12-10 15:12:18]   [1/66] Fitting Linear...
[2025-12-10 15:12:19]     ✓ AIC=1269.04, converged=False
[2025-12-10 15:12:19]   [2/66] Fitting Quadratic...
[2025-12-10 15:12:20]     ✓ AIC=872.44, converged=False
[2025-12-10 15:12:20]   [3/66] Fitting Cubic...
[2025-12-10 15:12:20]     ✓ AIC=866.65, converged=False
[2025-12-10 15:12:20]   [4/66] Fitting Quartic...
[2025-12-10 15:12:20]     ✓ AIC=315.63, converged=True
[2025-12-10 15:12:20]   [5/66] Fitting Quadratic_pure...
[2025-12-10 15:12:21]     ✓ AIC=871.82, converged=False
[2025-12-10 15:12:21]   [6/66] Fitting Cubic_pure...
[2025-12-10 15:12:21]     ✓ AIC=524.89, converged=True
[2025-12-10 15:12:21]   [7/66] Fitting Log...
[2025-12-10 15:12:21]     ✓ AIC=319.22, converged=True
[2025-12-10 15:12:21]   [8/66] Fitting Log2...
[2025-12-10 15:12:22]     ✓ AIC=319.22, converged=True
[2025-12-10 15:12:22]   [9/66] Fitting Log10...
[2025-12-10 15:12:22]     ✓ AIC=319.22, converged=True
[2025-12-10 15:12:22]   [10/66] Fitting LogLog...
[2025-12-10 15:12:22]     ✓ AIC=313.24, converged=True
[2025-12-10 15:12:22]   [11/66] Fitting Lin+Log...
[2025-12-10 15:12:22]     ✓ AIC=318.81, converged=True
[2025-12-10 15:12:22]   [12/66] Fitting Quad+Log...
[2025-12-10 15:12:22]     ✓ AIC=317.06, converged=True
[2025-12-10 15:12:22]   [13/66] Fitting Log+LogLog...
[2025-12-10 15:12:22]     ✓ AIC=312.71, converged=True
[2025-12-10 15:12:22]   [14/66] Fitting Lin+Quad+Log...
[2025-12-10 15:12:22]     ✓ AIC=317.06, converged=True
[2025-12-10 15:12:22]   [15/66] Fitting PowerLaw_01...
[2025-12-10 15:12:23]     ✓ AIC=316.04, converged=True
[2025-12-10 15:12:23]   [16/66] Fitting PowerLaw_02...
[2025-12-10 15:12:23]     ✓ AIC=314.16, converged=True
[2025-12-10 15:12:23]   [17/66] Fitting PowerLaw_03...
[2025-12-10 15:12:23]     ✓ AIC=313.40, converged=True
[2025-12-10 15:12:23]   [18/66] Fitting PowerLaw_04...
[2025-12-10 15:12:23]     ✓ AIC=313.59, converged=True
[2025-12-10 15:12:23]   [19/66] Fitting PowerLaw_05...
[2025-12-10 15:12:23]     ✓ AIC=314.52, converged=True
[2025-12-10 15:12:23]   [20/66] Fitting PowerLaw_06...
[2025-12-10 15:12:23]     ✓ AIC=316.04, converged=True
[2025-12-10 15:12:23]   [21/66] Fitting PowerLaw_07...
[2025-12-10 15:12:23]     ✓ AIC=317.96, converged=True
[2025-12-10 15:12:23]   [22/66] Fitting PowerLaw_08...
[2025-12-10 15:12:24]     ✓ AIC=320.15, converged=True
[2025-12-10 15:12:24]   [23/66] Fitting PowerLaw_09...
[2025-12-10 15:12:24]     ✓ AIC=322.50, converged=True
[2025-12-10 15:12:24]   [24/66] Fitting PowerLaw_10...
[2025-12-10 15:12:24]     ✓ AIC=324.90, converged=True
[2025-12-10 15:12:24]   [25/66] Fitting PowerLaw_Log...
[2025-12-10 15:12:24]     ✓ AIC=316.10, converged=True
[2025-12-10 15:12:24]   [26/66] Fitting PowerLaw_Lin...
[2025-12-10 15:12:24]     ✓ AIC=317.41, converged=True
[2025-12-10 15:12:24]   [27/66] Fitting SquareRoot...
[2025-12-10 15:12:24]     ✓ AIC=314.74, converged=True
[2025-12-10 15:12:24]   [28/66] Fitting CubeRoot...
[2025-12-10 15:12:25]     ✓ AIC=305.85, converged=True
[2025-12-10 15:12:25]   [29/66] Fitting FourthRoot...
[2025-12-10 15:12:25]     ✓ AIC=307.77, converged=True
[2025-12-10 15:12:25]   [30/66] Fitting Root_033...
[2025-12-10 15:12:25]     ✓ AIC=305.86, converged=True
[2025-12-10 15:12:25]   [31/66] Fitting Root_067...
[2025-12-10 15:12:25]     ✓ AIC=342.80, converged=True
[2025-12-10 15:12:25]   [32/66] Fitting SquareRoot+Log...
[2025-12-10 15:12:25]     ✓ AIC=315.18, converged=True
[2025-12-10 15:12:25]   [33/66] Fitting CubeRoot+Log...
[2025-12-10 15:12:25]     ✓ AIC=309.40, converged=True
[2025-12-10 15:12:25]   [34/66] Fitting SquareRoot+Lin...
[2025-12-10 15:12:25]     ✓ AIC=314.12, converged=True
[2025-12-10 15:12:25]   [35/66] Fitting Root_Multi...
[2025-12-10 15:12:26]     ✓ AIC=307.69, converged=True
[2025-12-10 15:12:26]   [36/66] Fitting Reciprocal...
[2025-12-10 15:12:26]     ✓ AIC=324.90, converged=True
[2025-12-10 15:12:26]   [37/66] Fitting Recip+Log...
[2025-12-10 15:12:26]     ✓ AIC=315.07, converged=True
[2025-12-10 15:12:26]   [38/66] Fitting Recip+Lin...
[2025-12-10 15:12:26]     ✓ AIC=314.27, converged=True
[2025-12-10 15:12:26]   [39/66] Fitting Recip+Quad...
[2025-12-10 15:12:26]     ✓ AIC=317.15, converged=True
[2025-12-10 15:12:26]   [40/66] Fitting Recip_sq...
[2025-12-10 15:12:26]     ✓ AIC=343.75, converged=True
[2025-12-10 15:12:26]   [41/66] Fitting Recip+PowerLaw...
[2025-12-10 15:12:26]     ✓ AIC=315.51, converged=True
[2025-12-10 15:12:26]   [42/66] Fitting Exponential_proxy...
[2025-12-10 15:12:27]     ✓ AIC=1269.04, converged=False
[2025-12-10 15:12:27]   [43/66] Fitting Exp+Log...
[2025-12-10 15:12:27]     ✓ AIC=318.81, converged=True
[2025-12-10 15:12:27]   [44/66] Fitting Exp+Lin...
[2025-12-10 15:12:27]     ✗ FAILED: Singular matrix
[2025-12-10 15:12:27]   [45/66] Fitting Exp_fast...
[2025-12-10 15:12:28]     ✓ AIC=871.82, converged=False
[2025-12-10 15:12:28]   [46/66] Fitting Exp_slow...
[2025-12-10 15:12:28]     ✓ AIC=314.74, converged=True
[2025-12-10 15:12:28]   [47/66] Fitting Exp+PowerLaw...
[2025-12-10 15:12:28]     ✓ AIC=312.48, converged=True
[2025-12-10 15:12:28]   [48/66] Fitting Exp+Recip...
[2025-12-10 15:12:28]     ✓ AIC=307.38, converged=True
[2025-12-10 15:12:28]   [49/66] Fitting Sin...
[2025-12-10 15:12:29]     ✓ AIC=479.36, converged=True
[2025-12-10 15:12:29]   [50/66] Fitting Cos...
[2025-12-10 15:12:29]     ✓ AIC=937.89, converged=False
[2025-12-10 15:12:29]   [51/66] Fitting Sin+Cos...
[2025-12-10 15:12:30]     ✓ AIC=871.38, converged=False
[2025-12-10 15:12:30]   [52/66] Fitting Sin+Log...
[2025-12-10 15:12:30]     ✓ AIC=321.15, converged=True
[2025-12-10 15:12:30]   [53/66] Fitting Tanh...
[2025-12-10 15:12:30]     ✓ AIC=884.85, converged=False
[2025-12-10 15:12:30]   [54/66] Fitting Tanh+Log...
[2025-12-10 15:12:31]     ✓ AIC=318.21, converged=True
[2025-12-10 15:12:31]   [55/66] Fitting Arctanh...
[2025-12-10 15:12:31]     ✓ AIC=915.65, converged=False
[2025-12-10 15:12:31]   [56/66] Fitting Sinh...
[2025-12-10 15:12:32]     ✓ AIC=905.97, converged=False
[2025-12-10 15:12:32]   [57/66] Fitting Log+PowerLaw05...
[2025-12-10 15:12:32]     ✓ AIC=314.11, converged=True
[2025-12-10 15:12:32]   [58/66] Fitting Log+SquareRoot...
[2025-12-10 15:12:32]     ✓ AIC=315.14, converged=True
[2025-12-10 15:12:32]   [59/66] Fitting Log+Recip...
[2025-12-10 15:12:32]     ✓ AIC=311.15, converged=True
[2025-12-10 15:12:32]   [60/66] Fitting SquareRoot+PowerLaw...
[2025-12-10 15:12:32]     ✓ AIC=311.02, converged=True
[2025-12-10 15:12:32]   [61/66] Fitting SquareRoot+Recip...
[2025-12-10 15:12:32]     ✓ AIC=307.27, converged=True
[2025-12-10 15:12:32]   [62/66] Fitting Recip+PowerLaw05...
[2025-12-10 15:12:33]     ✓ AIC=315.51, converged=True
[2025-12-10 15:12:33]   [63/66] Fitting Lin+Log+PowerLaw...
[2025-12-10 15:12:33]     ✓ AIC=309.66, converged=True
[2025-12-10 15:12:33]   [64/66] Fitting Quad+Log+SquareRoot...
[2025-12-10 15:12:33]     ✓ AIC=301.13, converged=True
[2025-12-10 15:12:33]   [65/66] Fitting PowerLaw+Recip+Log...
[2025-12-10 15:12:33]     ✓ AIC=308.82, converged=True
[2025-12-10 15:12:33]   [66/66] Fitting Ultimate...
[2025-12-10 15:12:33]     ✓ AIC=299.94, converged=True
[2025-12-10 15:12:33]   Successful fits: 65/66
[2025-12-10 15:12:33]   Failed fits: 1
[2025-12-10 15:12:33] [COMPUTE] Computing AIC comparison metrics...
[2025-12-10 15:12:33]   Minimum AIC: 299.94
[2025-12-10 15:12:33]   delta_AIC range: [0.00, 969.10]
[2025-12-10 15:12:33]   Akaike weight sum: 1.000000 (should be 1.0)
[2025-12-10 15:12:33] [RESULTS] Identifying best model...
[2025-12-10 15:12:33]   Best model: Ultimate
[2025-12-10 15:12:33]   AIC: 299.94
[2025-12-10 15:12:33]   Akaike weight: 0.5563 (55.6%)
[2025-12-10 15:12:33]   Uncertainty: Moderate (30-60% probability - substantial uncertainty)
[2025-12-10 15:12:33]   Log model (benchmark): Rank #45, AIC=319.22, Δ=19.29, weight=0.0000
[2025-12-10 15:12:33] [VALIDATION] Validating AIC comparison metrics...
[2025-12-10 15:12:33]   ✓ Akaike weights sum to 1.0 (1.000000)
[2025-12-10 15:12:33]   ✓ All Akaike weights in (0, 1)
[2025-12-10 15:12:33]   ✓ Best model has delta_AIC = 0
[2025-12-10 15:12:33]   ✓ cumulative_weight monotonic increasing
[2025-12-10 15:12:33]   ✓ cumulative_weight ends at 1.0 (1.000000)
[2025-12-10 15:12:33] [OUTPUT] Preparing output dictionary...
[2025-12-10 15:12:33]   Competitive models (ΔAIC < 2): 2
[2025-12-10 15:12:33] [SAVE] Saving outputs to /home/etai/projects/REMEMVR/results/ch6/6.3.1/data...
[2025-12-10 15:12:33]   ✓ model_comparison.csv
[2025-12-10 15:12:33]   ✓ best_model_summary.txt[SUCCESS] Best model: Ultimate (AIC=299.94)
================================================================================
