[2025-12-09 20:53:21] ================================================================================
[2025-12-09 20:53:21] LMM Model Selection: Kitchen Sink Suite
[2025-12-09 20:53:21] ================================================================================
[2025-12-09 20:53:21] [VALIDATION] Checking inputs...
[2025-12-09 20:53:21]   TSVR variable: TSVR_hours
[2025-12-09 20:53:21]   TSVR range: [1.00, 246.24] hours
[2025-12-09 20:53:21]   TSVR unique values: 295
[2025-12-09 20:53:21]   Outcome: CTT_mean
[2025-12-09 20:53:21]   Groups: UID (N=100)
[2025-12-09 20:53:21]   N observations: 1200
[2025-12-09 20:53:21]   Factor 1: congruence (categorical, ref=common)
[2025-12-09 20:53:21]   Interaction: 1-way (time × factor1)
[2025-12-09 20:53:21]   Random effects: ~1
[2025-12-09 20:53:21]   REML: False
[2025-12-09 20:53:21] [TRANSFORM] Creating time transformations...
[2025-12-09 20:53:21]   Polynomial family...
[2025-12-09 20:53:21]   Logarithmic family...
[2025-12-09 20:53:21]   Power law family...
[2025-12-09 20:53:21]   Root family...
[2025-12-09 20:53:21]   Reciprocal family...
[2025-12-09 20:53:21]   Exponential family...
[2025-12-09 20:53:21]   Trigonometric family...
[2025-12-09 20:53:21]   Hyperbolic family...
[2025-12-09 20:53:21]   Total transformations created: 32
[2025-12-09 20:53:21] [CONFIG] Defining model suite...
[2025-12-09 20:53:21]   Total models defined: 66
[2025-12-09 20:53:21] [FORMULA] Building model formulas...
[2025-12-09 20:53:21]   Example formula (Linear): CTT_mean ~ TSVR * C(congruence, Treatment('common'))
[2025-12-09 20:53:21]   Example formula (Log): CTT_mean ~ log_TSVR * C(congruence, Treatment('common'))
[2025-12-09 20:53:21] [ANALYSIS] Fitting all models...
[2025-12-09 20:53:21]   This may take 5-10 minutes for 66 models...
[2025-12-09 20:53:21]   [1/66] Fitting Linear...
[2025-12-09 20:53:22]     ✓ AIC=-1063.46, converged=True
[2025-12-09 20:53:22]   [2/66] Fitting Quadratic...
[2025-12-09 20:53:22]     ✓ AIC=-1075.87, converged=True
[2025-12-09 20:53:22]   [3/66] Fitting Cubic...
[2025-12-09 20:53:22]     ✓ AIC=-1074.02, converged=True
[2025-12-09 20:53:22]   [4/66] Fitting Quartic...
[2025-12-09 20:53:22]     ✓ AIC=-1072.43, converged=True
[2025-12-09 20:53:22]   [5/66] Fitting Quadratic_pure...
[2025-12-09 20:53:22]     ✓ AIC=-1020.52, converged=True
[2025-12-09 20:53:22]   [6/66] Fitting Cubic_pure...
[2025-12-09 20:53:22]     ✓ AIC=-986.55, converged=True
[2025-12-09 20:53:22]   [7/66] Fitting Log...
[2025-12-09 20:53:23]     ✓ AIC=-1080.14, converged=True
[2025-12-09 20:53:23]   [8/66] Fitting Log2...
[2025-12-09 20:53:23]     ✓ AIC=-1080.14, converged=True
[2025-12-09 20:53:23]   [9/66] Fitting Log10...
[2025-12-09 20:53:23]     ✓ AIC=-1080.14, converged=True
[2025-12-09 20:53:23]   [10/66] Fitting LogLog...
[2025-12-09 20:53:23]     ✓ AIC=-1076.51, converged=True
[2025-12-09 20:53:23]   [11/66] Fitting Lin+Log...
[2025-12-09 20:53:23]     ✓ AIC=-1078.17, converged=True
[2025-12-09 20:53:23]   [12/66] Fitting Quad+Log...
[2025-12-09 20:53:23]     ✓ AIC=-1076.52, converged=True
[2025-12-09 20:53:23]   [13/66] Fitting Log+LogLog...
[2025-12-09 20:53:23]     ✓ AIC=-1078.60, converged=True
[2025-12-09 20:53:23]   [14/66] Fitting Lin+Quad+Log...
[2025-12-09 20:53:24]     ✓ AIC=-1076.52, converged=True
[2025-12-09 20:53:24]   [15/66] Fitting PowerLaw_01...
[2025-12-09 20:53:24]     ✓ AIC=-1080.14, converged=True
[2025-12-09 20:53:24]   [16/66] Fitting PowerLaw_02...
[2025-12-09 20:53:24]     ✓ AIC=-1079.81, converged=True
[2025-12-09 20:53:24]   [17/66] Fitting PowerLaw_03...
[2025-12-09 20:53:24]     ✓ AIC=-1079.17, converged=True
[2025-12-09 20:53:24]   [18/66] Fitting PowerLaw_04...
[2025-12-09 20:53:24]     ✓ AIC=-1078.24, converged=True
[2025-12-09 20:53:24]   [19/66] Fitting PowerLaw_05...
[2025-12-09 20:53:24]     ✓ AIC=-1077.06, converged=True
[2025-12-09 20:53:24]   [20/66] Fitting PowerLaw_06...
[2025-12-09 20:53:25]     ✓ AIC=-1075.63, converged=True
[2025-12-09 20:53:25]   [21/66] Fitting PowerLaw_07...
[2025-12-09 20:53:25]     ✓ AIC=-1074.00, converged=True
[2025-12-09 20:53:25]   [22/66] Fitting PowerLaw_08...
[2025-12-09 20:53:25]     ✓ AIC=-1072.20, converged=True
[2025-12-09 20:53:25]   [23/66] Fitting PowerLaw_09...
[2025-12-09 20:53:25]     ✓ AIC=-1070.25, converged=True
[2025-12-09 20:53:25]   [24/66] Fitting PowerLaw_10...
[2025-12-09 20:53:25]     ✓ AIC=-1068.20, converged=True
[2025-12-09 20:53:25]   [25/66] Fitting PowerLaw_Log...
[2025-12-09 20:53:25]     ✓ AIC=-1078.15, converged=True
[2025-12-09 20:53:25]   [26/66] Fitting PowerLaw_Lin...
[2025-12-09 20:53:26]     ✓ AIC=-1076.94, converged=True
[2025-12-09 20:53:26]   [27/66] Fitting SquareRoot...
[2025-12-09 20:53:26]     ✓ AIC=-1079.61, converged=True
[2025-12-09 20:53:26]   [28/66] Fitting CubeRoot...
[2025-12-09 20:53:26]     ✓ AIC=-1078.46, converged=True
[2025-12-09 20:53:26]   [29/66] Fitting FourthRoot...
[2025-12-09 20:53:26]     ✓ AIC=-1076.07, converged=True
[2025-12-09 20:53:26]   [30/66] Fitting Root_033...
[2025-12-09 20:53:26]     ✓ AIC=-1078.46, converged=True
[2025-12-09 20:53:26]   [31/66] Fitting Root_067...
[2025-12-09 20:53:26]     ✓ AIC=-1076.55, converged=True
[2025-12-09 20:53:26]   [32/66] Fitting SquareRoot+Log...
[2025-12-09 20:53:27]     ✓ AIC=-1078.20, converged=True
[2025-12-09 20:53:27]   [33/66] Fitting CubeRoot+Log...
[2025-12-09 20:53:27]     ✓ AIC=-1078.14, converged=True
[2025-12-09 20:53:27]   [34/66] Fitting SquareRoot+Lin...
[2025-12-09 20:53:27]     ✓ AIC=-1076.95, converged=True
[2025-12-09 20:53:27]   [35/66] Fitting Root_Multi...
[2025-12-09 20:53:27]     ✓ AIC=-1078.02, converged=True
[2025-12-09 20:53:27]   [36/66] Fitting Reciprocal...
[2025-12-09 20:53:27]     ✓ AIC=-1068.20, converged=True
[2025-12-09 20:53:27]   [37/66] Fitting Recip+Log...
[2025-12-09 20:53:28]     ✓ AIC=-1078.14, converged=True
[2025-12-09 20:53:28]   [38/66] Fitting Recip+Lin...
[2025-12-09 20:53:28]     ✓ AIC=-1076.45, converged=True
[2025-12-09 20:53:28]   [39/66] Fitting Recip+Quad...
[2025-12-09 20:53:28]     ✓ AIC=-1074.99, converged=True
[2025-12-09 20:53:28]   [40/66] Fitting Recip_sq...
[2025-12-09 20:53:28]     ✓ AIC=-1046.94, converged=True
[2025-12-09 20:53:28]   [41/66] Fitting Recip+PowerLaw...
[2025-12-09 20:53:28]     ✓ AIC=-1078.64, converged=True
[2025-12-09 20:53:28]   [42/66] Fitting Exponential_proxy...
[2025-12-09 20:53:28]     ✓ AIC=-1063.46, converged=True
[2025-12-09 20:53:28]   [43/66] Fitting Exp+Log...
[2025-12-09 20:53:29]     ✓ AIC=-1078.17, converged=True
[2025-12-09 20:53:29]   [44/66] Fitting Exp+Lin...
[2025-12-09 20:53:29]     ✗ FAILED: Singular matrix
[2025-12-09 20:53:29]   [45/66] Fitting Exp_fast...
[2025-12-09 20:53:29]     ✓ AIC=-1020.52, converged=True
[2025-12-09 20:53:29]   [46/66] Fitting Exp_slow...
[2025-12-09 20:53:29]     ✓ AIC=-1079.61, converged=True
[2025-12-09 20:53:29]   [47/66] Fitting Exp+PowerLaw...
[2025-12-09 20:53:29]     ✓ AIC=-1078.18, converged=True
[2025-12-09 20:53:29]   [48/66] Fitting Exp+Recip...
[2025-12-09 20:53:29]     ✓ AIC=-1078.03, converged=True
[2025-12-09 20:53:29]   [49/66] Fitting Sin...
[2025-12-09 20:53:30]     ✓ AIC=-908.89, converged=True
[2025-12-09 20:53:30]   [50/66] Fitting Cos...
[2025-12-09 20:53:30]     ✓ AIC=-1059.98, converged=True
[2025-12-09 20:53:30]   [51/66] Fitting Sin+Cos...
[2025-12-09 20:53:30]     ✓ AIC=-1057.99, converged=True
[2025-12-09 20:53:30]   [52/66] Fitting Sin+Log...
[2025-12-09 20:53:30]     ✓ AIC=-1078.15, converged=True
[2025-12-09 20:53:30]   [53/66] Fitting Tanh...
[2025-12-09 20:53:30]     ✓ AIC=-1069.27, converged=True
[2025-12-09 20:53:30]   [54/66] Fitting Tanh+Log...
[2025-12-09 20:53:31]     ✓ AIC=-1078.15, converged=True
[2025-12-09 20:53:31]   [55/66] Fitting Arctanh...
[2025-12-09 20:53:31]     ✓ AIC=-1029.71, converged=True
[2025-12-09 20:53:31]   [56/66] Fitting Sinh...
[2025-12-09 20:53:31]     ✓ AIC=-1059.57, converged=True
[2025-12-09 20:53:31]   [57/66] Fitting Log+PowerLaw05...
[2025-12-09 20:53:31]     ✓ AIC=-1078.56, converged=True
[2025-12-09 20:53:31]   [58/66] Fitting Log+SquareRoot...
[2025-12-09 20:53:31]     ✓ AIC=-1078.21, converged=True
[2025-12-09 20:53:31]   [59/66] Fitting Log+Recip...
[2025-12-09 20:53:31]     ✓ AIC=-1078.90, converged=True
[2025-12-09 20:53:31]   [60/66] Fitting SquareRoot+PowerLaw...
[2025-12-09 20:53:32]     ✓ AIC=-1078.19, converged=True
[2025-12-09 20:53:32]   [61/66] Fitting SquareRoot+Recip...
[2025-12-09 20:53:32]     ✓ AIC=-1078.45, converged=True
[2025-12-09 20:53:32]   [62/66] Fitting Recip+PowerLaw05...
[2025-12-09 20:53:32]     ✓ AIC=-1078.64, converged=True
[2025-12-09 20:53:32]   [63/66] Fitting Lin+Log+PowerLaw...
[2025-12-09 20:53:32]     ✓ AIC=-1076.77, converged=True
[2025-12-09 20:53:32]   [64/66] Fitting Quad+Log+SquareRoot...
[2025-12-09 20:53:32]     ✓ AIC=-1074.79, converged=True
[2025-12-09 20:53:32]   [65/66] Fitting PowerLaw+Recip+Log...
[2025-12-09 20:53:33]     ✓ AIC=-1076.22, converged=True
[2025-12-09 20:53:33]   [66/66] Fitting Ultimate...
[2025-12-09 20:53:33]     ✓ AIC=-1074.26, converged=True
[2025-12-09 20:53:33]   Successful fits: 65/66
[2025-12-09 20:53:33]   Failed fits: 1
[2025-12-09 20:53:33] [COMPUTE] Computing AIC comparison metrics...
[2025-12-09 20:53:33]   Minimum AIC: -1080.14
[2025-12-09 20:53:33]   delta_AIC range: [0.00, 171.25]
[2025-12-09 20:53:33]   Akaike weight sum: 1.000000 (should be 1.0)
[2025-12-09 20:53:33] [RESULTS] Identifying best model...
[2025-12-09 20:53:33]   Best model: Log
[2025-12-09 20:53:33]   AIC: -1080.14
[2025-12-09 20:53:33]   Akaike weight: 0.0546 (5.5%)
[2025-12-09 20:53:33]   Uncertainty: High (<30% probability - weak support, consider model averaging)
[2025-12-09 20:53:33]   Log model (benchmark): Rank #1, AIC=-1080.14, Δ=0.00, weight=0.0546
[2025-12-09 20:53:33] [VALIDATION] Validating AIC comparison metrics...
[2025-12-09 20:53:33]   ✓ Akaike weights sum to 1.0 (1.000000)
[2025-12-09 20:53:33]   ✓ All Akaike weights in (0, 1)
[2025-12-09 20:53:33]   ✓ Best model has delta_AIC = 0
[2025-12-09 20:53:33]   ✓ cumulative_weight monotonic increasing
[2025-12-09 20:53:33]   ✓ cumulative_weight ends at 1.0 (1.000000)
[2025-12-09 20:53:33] [OUTPUT] Preparing output dictionary...
[2025-12-09 20:53:33]   Competitive models (ΔAIC < 2): 28
[2025-12-09 20:53:33] [SAVE] Saving outputs to /home/etai/projects/REMEMVR/results/ch5/5.4.4/data...
[2025-12-09 20:53:33]   ✓ model_comparison.csv
[2025-12-09 20:53:33]   ✓ best_model_summary.txt[DONE] CTT kitchen sink complete
  Models fitted: 65
[ANALYSIS] Computing convergence metrics for 66 model pairs...
[ERROR] Step 03b failed
  KeyError: 'fitted_models'
Traceback (most recent call last):
  File "/home/etai/projects/REMEMVR/results/ch5/5.4.4/code/step03b_extended_irt_ctt_convergence.py", line 258, in <module>
    irt_models = irt_results['fitted_models']
                 ~~~~~~~~~~~^^^^^^^^^^^^^^^^^
KeyError: 'fitted_models'

