[2025-12-10 15:12:34] ================================================================================
[2025-12-10 15:12:34] LMM Model Selection: Kitchen Sink Suite
[2025-12-10 15:12:34] ================================================================================
[2025-12-10 15:12:34] [VALIDATION] Checking inputs...
[2025-12-10 15:12:34]   TSVR variable: TSVR_hours
[2025-12-10 15:12:34]   TSVR range: [1.00, 246.24] hours
[2025-12-10 15:12:34]   TSVR unique values: 295
[2025-12-10 15:12:34]   Outcome: theta
[2025-12-10 15:12:34]   Groups: UID (N=100)
[2025-12-10 15:12:34]   N observations: 1200
[2025-12-10 15:12:34]   Factor 1: paradigm (categorical, ref=IFR)
[2025-12-10 15:12:34]   Interaction: 1-way (time × factor1)
[2025-12-10 15:12:34]   Random effects: ~TSVR_hours
[2025-12-10 15:12:34]   REML: False
[2025-12-10 15:12:34] [TRANSFORM] Creating time transformations...
[2025-12-10 15:12:34]   Polynomial family...
[2025-12-10 15:12:34]   Logarithmic family...
[2025-12-10 15:12:34]   Power law family...
[2025-12-10 15:12:34]   Root family...
[2025-12-10 15:12:34]   Reciprocal family...
[2025-12-10 15:12:34]   Exponential family...
[2025-12-10 15:12:34]   Trigonometric family...
[2025-12-10 15:12:34]   Hyperbolic family...
[2025-12-10 15:12:34]   Total transformations created: 32
[2025-12-10 15:12:34] [CONFIG] Defining model suite...
[2025-12-10 15:12:34]   Total models defined: 66
[2025-12-10 15:12:34] [FORMULA] Building model formulas...
[2025-12-10 15:12:34]   Example formula (Linear): theta ~ TSVR * C(paradigm, Treatment('IFR'))
[2025-12-10 15:12:34]   Example formula (Log): theta ~ log_TSVR * C(paradigm, Treatment('IFR'))
[2025-12-10 15:12:34] [ANALYSIS] Fitting all models...
[2025-12-10 15:12:34]   This may take 5-10 minutes for 66 models...
[2025-12-10 15:12:34]   [1/66] Fitting Linear...
[2025-12-10 15:12:34]     ✓ AIC=298.37, converged=True
[2025-12-10 15:12:34]   [2/66] Fitting Quadratic...
[2025-12-10 15:12:35]     ✓ AIC=753.66, converged=False
[2025-12-10 15:12:35]   [3/66] Fitting Cubic...
[2025-12-10 15:12:35]     ✓ AIC=751.46, converged=False
[2025-12-10 15:12:35]   [4/66] Fitting Quartic...
[2025-12-10 15:12:36]     ✓ AIC=732.18, converged=False
[2025-12-10 15:12:36]   [5/66] Fitting Quadratic_pure...
[2025-12-10 15:12:36]     ✓ AIC=752.65, converged=False
[2025-12-10 15:12:36]   [6/66] Fitting Cubic_pure...
[2025-12-10 15:12:37]     ✓ AIC=764.90, converged=False
[2025-12-10 15:12:37]   [7/66] Fitting Log...
[2025-12-10 15:12:37]     ✓ AIC=729.69, converged=False
[2025-12-10 15:12:37]   [8/66] Fitting Log2...
[2025-12-10 15:12:38]     ✓ AIC=729.69, converged=False
[2025-12-10 15:12:38]   [9/66] Fitting Log10...
[2025-12-10 15:12:38]     ✓ AIC=729.69, converged=True
[2025-12-10 15:12:38]   [10/66] Fitting LogLog...
[2025-12-10 15:12:39]     ✓ AIC=725.07, converged=False
[2025-12-10 15:12:39]   [11/66] Fitting Lin+Log...
[2025-12-10 15:12:39]     ✓ AIC=731.69, converged=False
[2025-12-10 15:12:39]   [12/66] Fitting Quad+Log...
[2025-12-10 15:12:40]     ✓ AIC=731.48, converged=False
[2025-12-10 15:12:40]   [13/66] Fitting Log+LogLog...
[2025-12-10 15:12:40]     ✓ AIC=725.12, converged=False
[2025-12-10 15:12:40]   [14/66] Fitting Lin+Quad+Log...
[2025-12-10 15:12:41]     ✓ AIC=731.48, converged=False
[2025-12-10 15:12:41]   [15/66] Fitting PowerLaw_01...
[2025-12-10 15:12:41]     ✓ AIC=728.90, converged=False
[2025-12-10 15:12:41]   [16/66] Fitting PowerLaw_02...
[2025-12-10 15:12:42]     ✓ AIC=728.17, converged=True
[2025-12-10 15:12:42]   [17/66] Fitting PowerLaw_03...
[2025-12-10 15:12:42]     ✓ AIC=727.49, converged=False
[2025-12-10 15:12:42]   [18/66] Fitting PowerLaw_04...
[2025-12-10 15:12:43]     ✓ AIC=726.87, converged=False
[2025-12-10 15:12:43]   [19/66] Fitting PowerLaw_05...
[2025-12-10 15:12:43]     ✓ AIC=726.31, converged=False
[2025-12-10 15:12:43]   [20/66] Fitting PowerLaw_06...
[2025-12-10 15:12:44]     ✓ AIC=725.81, converged=False
[2025-12-10 15:12:44]   [21/66] Fitting PowerLaw_07...
[2025-12-10 15:12:43]     ✓ AIC=725.36, converged=False
[2025-12-10 15:12:43]   [22/66] Fitting PowerLaw_08...
[2025-12-10 15:12:43]     ✓ AIC=724.96, converged=True
[2025-12-10 15:12:43]   [23/66] Fitting PowerLaw_09...
[2025-12-10 15:12:44]     ✓ AIC=724.60, converged=False
[2025-12-10 15:12:44]   [24/66] Fitting PowerLaw_10...
[2025-12-10 15:12:44]     ✓ AIC=724.30, converged=False
[2025-12-10 15:12:44]   [25/66] Fitting PowerLaw_Log...
[2025-12-10 15:12:45]     ✓ AIC=726.16, converged=False
[2025-12-10 15:12:45]   [26/66] Fitting PowerLaw_Lin...
[2025-12-10 15:12:45]     ✓ AIC=729.66, converged=False
[2025-12-10 15:12:45]   [27/66] Fitting SquareRoot...
[2025-12-10 15:12:46]     ✓ AIC=723.91, converged=False
[2025-12-10 15:12:46]   [28/66] Fitting CubeRoot...
[2025-12-10 15:12:46]     ✓ AIC=722.40, converged=False
[2025-12-10 15:12:46]   [29/66] Fitting FourthRoot...
[2025-12-10 15:12:47]     ✓ AIC=721.94, converged=False
[2025-12-10 15:12:47]   [30/66] Fitting Root_033...
[2025-12-10 15:12:48]     ✓ AIC=722.40, converged=False
[2025-12-10 15:12:48]   [31/66] Fitting Root_067...
[2025-12-10 15:12:48]     ✓ AIC=726.37, converged=False
[2025-12-10 15:12:48]   [32/66] Fitting SquareRoot+Log...
[2025-12-10 15:12:49]     ✓ AIC=722.99, converged=False
[2025-12-10 15:12:49]   [33/66] Fitting CubeRoot+Log...
[2025-12-10 15:12:49]     ✓ AIC=723.44, converged=False
[2025-12-10 15:12:49]   [34/66] Fitting SquareRoot+Lin...
[2025-12-10 15:12:50]     ✓ AIC=727.05, converged=False
[2025-12-10 15:12:50]   [35/66] Fitting Root_Multi...
[2025-12-10 15:12:50]     ✓ AIC=723.71, converged=False
[2025-12-10 15:12:50]   [36/66] Fitting Reciprocal...
[2025-12-10 15:12:51]     ✓ AIC=724.30, converged=False
[2025-12-10 15:12:51]   [37/66] Fitting Recip+Log...
[2025-12-10 15:12:51]     ✓ AIC=725.54, converged=False
[2025-12-10 15:12:51]   [38/66] Fitting Recip+Lin...
[2025-12-10 15:12:52]     ✓ AIC=727.51, converged=False
[2025-12-10 15:12:52]   [39/66] Fitting Recip+Quad...
[2025-12-10 15:12:53]     ✓ AIC=731.48, converged=False
[2025-12-10 15:12:53]   [40/66] Fitting Recip_sq...
[2025-12-10 15:12:53]     ✓ AIC=723.09, converged=False
[2025-12-10 15:12:53]   [41/66] Fitting Recip+PowerLaw...
[2025-12-10 15:12:54]     ✓ AIC=725.10, converged=False
[2025-12-10 15:12:54]   [42/66] Fitting Exponential_proxy...
[2025-12-10 15:12:54]     ✓ AIC=298.37, converged=True
[2025-12-10 15:12:54]   [43/66] Fitting Exp+Log...
[2025-12-10 15:12:54]     ✓ AIC=731.69, converged=False
[2025-12-10 15:12:54]   [44/66] Fitting Exp+Lin...
[2025-12-10 15:12:54]     ✗ FAILED: Singular matrix
[2025-12-10 15:12:54]   [45/66] Fitting Exp_fast...
[2025-12-10 15:12:55]     ✓ AIC=752.65, converged=False
[2025-12-10 15:12:55]   [46/66] Fitting Exp_slow...
[2025-12-10 15:12:55]     ✓ AIC=723.91, converged=False
[2025-12-10 15:12:55]   [47/66] Fitting Exp+PowerLaw...
[2025-12-10 15:12:56]     ✓ AIC=728.29, converged=False
[2025-12-10 15:12:56]   [48/66] Fitting Exp+Recip...
[2025-12-10 15:12:56]     ✓ AIC=726.25, converged=False
[2025-12-10 15:12:56]   [49/66] Fitting Sin...
[2025-12-10 15:12:57]     ✓ AIC=764.90, converged=False
[2025-12-10 15:12:57]   [50/66] Fitting Cos...
[2025-12-10 15:12:57]     ✓ AIC=815.90, converged=False
[2025-12-10 15:12:57]   [51/66] Fitting Sin+Cos...
[2025-12-10 15:12:58]     ✓ AIC=755.41, converged=False
[2025-12-10 15:12:58]   [52/66] Fitting Sin+Log...
[2025-12-10 15:12:59]     ✓ AIC=720.03, converged=False
[2025-12-10 15:12:59]   [53/66] Fitting Tanh...
[2025-12-10 15:12:59]     ✓ AIC=762.65, converged=False
[2025-12-10 15:12:59]   [54/66] Fitting Tanh+Log...
[2025-12-10 15:13:00]     ✓ AIC=730.34, converged=False
[2025-12-10 15:13:00]   [55/66] Fitting Arctanh...
[2025-12-10 15:13:00]     ✓ AIC=797.41, converged=False
[2025-12-10 15:13:00]   [56/66] Fitting Sinh...
[2025-12-10 15:13:01]     ✓ AIC=780.32, converged=False
[2025-12-10 15:13:01]   [57/66] Fitting Log+PowerLaw05...
[2025-12-10 15:13:01]     ✓ AIC=725.98, converged=False
[2025-12-10 15:13:01]   [58/66] Fitting Log+SquareRoot...
[2025-12-10 15:13:02]     ✓ AIC=723.05, converged=False
[2025-12-10 15:13:02]   [59/66] Fitting Log+Recip...
[2025-12-10 15:13:03]     ✓ AIC=725.46, converged=False
[2025-12-10 15:13:03]   [60/66] Fitting SquareRoot+PowerLaw...
[2025-12-10 15:13:03]     ✓ AIC=720.57, converged=False
[2025-12-10 15:13:03]   [61/66] Fitting SquareRoot+Recip...
[2025-12-10 15:13:04]     ✓ AIC=725.65, converged=False
[2025-12-10 15:13:04]   [62/66] Fitting Recip+PowerLaw05...
[2025-12-10 15:13:04]     ✓ AIC=725.10, converged=False
[2025-12-10 15:13:04]   [63/66] Fitting Lin+Log+PowerLaw...
[2025-12-10 15:13:05]     ✓ AIC=727.75, converged=False
[2025-12-10 15:13:05]   [64/66] Fitting Quad+Log+SquareRoot...
[2025-12-10 15:13:05]     ✓ AIC=717.69, converged=False
[2025-12-10 15:13:05]   [65/66] Fitting PowerLaw+Recip+Log...
[2025-12-10 15:13:06]     ✓ AIC=719.26, converged=False
[2025-12-10 15:13:06]   [66/66] Fitting Ultimate...
[2025-12-10 15:13:06]     ✓ AIC=719.74, converged=False
[2025-12-10 15:13:06]   Successful fits: 65/66
[2025-12-10 15:13:06]   Failed fits: 1
[2025-12-10 15:13:06] [COMPUTE] Computing AIC comparison metrics...
[2025-12-10 15:13:06]   Minimum AIC: 298.37
[2025-12-10 15:13:06]   delta_AIC range: [0.00, 517.53]
[2025-12-10 15:13:06]   Akaike weight sum: 1.000000 (should be 1.0)
[2025-12-10 15:13:06] [RESULTS] Identifying best model...
[2025-12-10 15:13:06]   Best model: Linear
[2025-12-10 15:13:06]   AIC: 298.37
[2025-12-10 15:13:06]   Akaike weight: 0.5000 (50.0%)
[2025-12-10 15:13:06]   Uncertainty: Moderate (30-60% probability - substantial uncertainty)
[2025-12-10 15:13:06]   Log model (benchmark): Rank #45, AIC=729.69, Δ=431.32, weight=0.0000
[2025-12-10 15:13:06] [VALIDATION] Validating AIC comparison metrics...
[2025-12-10 15:13:06]   ✓ Akaike weights sum to 1.0 (1.000000)
[2025-12-10 15:13:06]   ✓ All Akaike weights in (0, 1)
[2025-12-10 15:13:06]   ✓ Best model has delta_AIC = 0
[2025-12-10 15:13:06]   ✓ cumulative_weight monotonic increasing
[2025-12-10 15:13:06]   ✓ cumulative_weight ends at 1.0 (1.000000)
[2025-12-10 15:13:06] [OUTPUT] Preparing output dictionary...
[2025-12-10 15:13:06]   Competitive models (ΔAIC < 2): 2
[2025-12-10 15:13:06] [SAVE] Saving outputs to /home/etai/projects/REMEMVR/results/ch6/6.4.1/data...
[2025-12-10 15:13:06]   ✓ model_comparison.csv
[2025-12-10 15:13:06]   ✓ best_model_summary.txt[SUCCESS] Best model: Linear (AIC=298.37)
================================================================================
